{
  "contracts": {
    "byContract": [
      {
        "id": "BOTTOM_ACTIONS_OWNERSHIP",
        "status": "pass",
        "violations": 0
      },
      {
        "id": "SAFE_AREA_OWNERSHIP",
        "status": "pass",
        "violations": 0
      },
      {
        "id": "SERVER_CLIENT_BOUNDARY",
        "status": "pass",
        "violations": 0
      },
      {
        "id": "SINGLE_SCROLL_OWNER",
        "status": "pass",
        "violations": 0
      }
    ],
    "summary": {
      "fail": 0,
      "pass": 4,
      "warn": 0
    }
  },
  "engine": {
    "commit": "762b9320897c",
    "name": "playbook-engine",
    "statusSchemaVersion": "1.0",
    "version": "0.0.0"
  },
  "generatedAt": "2026-03-04T09:34:12.252Z",
  "knowledge": {
    "draft": {
      "count": 0
    },
    "promoted": {
      "count": 0
    },
    "proposed": {
      "count": 59
    }
  },
  "recommendation": {
    "nextCommand": "npm run playbook:promote -- --stage=promoted",
    "reason": "Knowledge lifecycle thresholds indicate promotion readiness.",
    "suggestedWhen": "before_pr"
  },
  "repo": {
    "name": "Playbook",
    "root": "/workspace/Playbook"
  },
  "version": "1.0"
}
